id,topic,content,tags
1,consultation,"We start with a brief consultation to understand your matter and determine next steps. A written engagement is required before representation begins.","consultation,process,engagement"
2,fees,"Fees depend on scope and complexity. We discuss options such as flat-fee or hourly arrangements after an initial review.","fees,pricing,engagement"
3,timeline,"Timelines vary by matter type and court schedules. We will outline expected milestones once we understand the facts.","timeline,process"
4,confidentiality,"Please do not send sensitive details through the website. Contact form submissions do not create an attorney–client relationship.","confidentiality,disclaimer"
5,documents,"Helpful items include relevant contracts, correspondence, court notices, and key dates.","documents,preparation"
6,practice areas,"We assist with business contracts, family law matters, real estate transactions, and estate planning.","services,practice areas"
